response,page,survey
"Schools, churches, government, and families work together.",48,city
"Smaller class size, more after school free spaces. Invest in school facilities.",48,city
Smaller class sizes so kids with ADHD or behavior challenges aren't constantly removed from classrooms.  They need more support and different solutions.,48,city
"Smaller classrooms. More pay for teachers (you get what you pay for). Education should be number one concern not athletics. Sports are ok but must maintain GPA to play. Need every day gym classes. Life skills classes on marriage, budget. And applying for jobs. Trade schools. Parenting classes. Paying taxes.",48,city
Some schools are underfunded and poorly run with racial problems. My family had to move to a neighborhood with a better school though they hated to move.,48,city
Spend money in schools and actually commit to it.,48,city
"Spend more money on public education, teachers, keeping kids in school.",48,city
Stop calling Durham city police unless they don't carry guns.,48,city
Stop enforcing laws that prohibit marijuana use.,48,city
Stop pushing race as the primary factor that children cannot succeed. Focus on providing quality education on the core competencies. Provide more law enforcement in high crime /gang areas so that children don’t live in fear.,48,city
Strong public schools regardless of neighborhood.,48,city
Substantial improvement of quality of academic rather than teacher union directed instruction and curriculum at all public schools.,49,city
Support and encourage better and more involved parenting.,49,city
Support charter schools.,49,city
Support programs like Kidznotes.,49,city
"Support public schools: quality, variety of instruction, teacher pay to attract good teachers, etc.",49,city
"Support the educators, good salary, money to buy needed supplies for all.",49,city
Support the neighborhood groups that are working on these goals and follow their lead and wisdom.,49,city
Take care of the teachers.,49,city
Teach them Dave Ramsey financial literacy.,49,city
Teachers need to get paid more.,49,city
Teenager having a place to go to get help with school and finding meaningful work that could take them into adulthood.,49,city
Teenagers starting at 11 need programs and community-based spaces to help them learn.,49,city
"Teens: High school age, there should be more teen related facilities for gathering and mingling with friend. The Streets at South Point used to allow for this until the Northgate mall closed",49,city
"The efforts of the P&R, library and social services are good. I like that the police & fire dept do annual community events. Please refurbish and maintain low-income housing. I would like to see more housing neighborhoods & quality construction in the 100K price range. Durham has a lot of high end and low end and not much in the middle.",49,city
"The magnet school system is a great start. Decent housing for all kids is so important--functional housing away from crime areas and safe transit to schools. After-school programs for kids whose parents must work. Safe places for kids to be when their guardians aren't around.  Alternative outlets for youth angst and energy (alternative to gangs.)  Not de-fund the police but add a ""social worker"" component.",49,city
"There are huge socio-economic disparities existing in Durham right now, and gentrification is pushing marginalized people out. We need to start with affordable housing that is pleasant. Then fix school facilities and ensure enough bus drivers, teachers, cafeteria workers. Then provide programming to teach skills and pull people out of poverty.",49,city
"To be safe, listen to the world and do the best they can and do your best.",49,city
Treat all the same.,49,city
"Try improving the quality of management in schools. Even if individual teachers are very good, continuity and consistency are lacking.  I believe I've read that DPS receives the second-highest level of funding per student in the state.  The outcomes don't reflect that. Stop the misguided downtown development. I don't need a Google office there.  Put it in the park. Durham's policy has exacerbated a housing crunch that may have been there anyway while losing out on economic development. You can call yourselves """"progressive"""" but having kids shot near my house, failing schools, and a lack of affordable housing isn't the kind of progress I want.",49,city
"Turning schools into community centers and safe spaces with social services resources, recreation for families and tutoring options & family education.",49,city
"Tutors, translators for the Spanish.",49,city
Universal pre k for all children.,49,city
Universal pre-k.,49,city
"Universal pre-k, skate parks.",50,city
Universal pre-k. Safe places to play in every neighborhood. More kids living in a supportive home environment.,50,city
Update all schools to be more compatible with society today.,50,city
"Use funds to give youth resources: better access to mental health services, opportunities/internships, education—rather than for new youth detention center.",50,city
Utilize retired and elderly for educational and skills training. It's a win/win situation.,50,city
Very important to improve this plan.,50,city
We need to improve the quality of teachers and seriously improve teachers’ salaries to recruit excellent teachers in public schools. I am a teacher in middle school.,50,city
Work on the quality of the public school system.,50,city
Work on the schools and crime.,50,city
Work to improve the quality of public schools. Add and improve sidewalks surrounding public schools so children can safely walk to school.,50,city
Work to stop the influence of gangs. Need more mentors and facilities to keep kids out of trouble and focusing on life-long skills.,50,city
"You can’t just have a few stand out teachers or schools and clap for yourself.  You have to have a good school system. The grades speak for themselves. These kids are undereducated in every category. I would move to a shack in Chapel Hill before I would live in a mansion in Durham and send my kid to public school in Durham. I tried Ignite! This year. Better—but really, it’s just OnDemand home schooling.",50,city
"Young children need a strong male & female model of good character as they grow & mature. Children might meet their potential if the city & county encouraged “family” events, supported Big Brother type of organizations, & supported unwed mothers not only with money but teaching them skills. Much research suggests that even 1 good person who models good behaviors can make a difference in a child’s life & help break the bad cycle from which the child comes. I know this research to be true from witnessing lives of people I know. They are people who broke out of the bad cycle & are now contributing members of society.",50,city
Youth centers.,50,city
Youth need a center for activities.,50,city
