response,page
A wide variety of after school programs.,1
"Abandon  charter  schools  and  ""magnet  schools"".  Use  the  money  to  improve  the  leadership, facilities, faculty of ALL of the public schools.",1
Access to mental health. Better Public Schools. Better early intervention and screening? how could my son’s level 2 (moderate) autism be completely missed?,1
"Access to quality free childcare, preschool, and aftercare.",1
Affordable childcare.,1
Affordable housing.,1
Affordable social/sports options. Tutoring available. School lotteries are not so exclusive.,1
"All ages ? drop the mandates and the vaccines and get back to empowering the young. They are your future too, you know.",1
All children need space to play and exercise with supervision and kindness.,1
All kids should have a mentor and a counselor that sees the best in them.,1
Allow more recreational activities for ALL children.,1
Allow people to make more of their own choices. Do not have so many mandates and laws and programs that the taxes to pay for all these programs stifles the affordability of living in Durham.,1
An indoor Rec center closer to SOUTH Durham (Southpoint area) for families down here.,1
Anything that will keep children on a path toward success commensurate with their abilities and level of effort. Remove obstacles that lead to their turning to gangs and crime and drugs and violent lifestyles.,1
"As far as I know, no one has come up with a solution to that problem.  Good luck trying.",1
"Be sure that all children regardless of ethnicity, income, etc. get the same opportunities.",1
Better after school programs and day care programs that are free or affordable.,1
Better funding for schools.,1
Better pay for teachers.,1
Better playground facilities and better public schools.,1
Better programs to reach men ages 25?35. Jobs! Programs that will help those who have some marks on their record to be productive working citizens. Stop ignoring that age group.,1
Better public transit system.,1
Better schools and food programs.,1
Better  schools  will  attract  more  teachers  with  experience.  More  support  will  retain  teachers. Increase teacher pay.,1
Bring back children club. Durham just needs to invest in the kids. Durham is only worried about the downtown area.,1
Bring prayer back into schools. Services to assist parents. Better access to affordable resources.,1
Build  more  community  centers.  Have  well  trained  police  officers  assigned  to  their  own neighborhoods.,1
"By making sure IEPs are followed through on. My sons were not, and the schooling was so bad I home schooled him for 1 year and now he is an Officer in the USMC. It is all about money and unfortunately the children with IEPs don't get the benefits.",1
Career training for middle and high school. increased funding.,1
Charter schools and vouchers.,1
Children need mentors and expectations to society. Parents need to ask for help and take advice. Quit letting kids run around unsupervised. Too much freedom. More activities to be involved in that reach and train them to be productive in society.,2
Children  should  never  be  given  back  to  parents  who  have  drug/alcohol  related  problem  and should have the potential to grow up in a healthy environment. Foster parents should be required to attend parenting classes and children be required to have checkups to make sure they are healthy.,2
"City and county should ensure resources are well allocated in schools, funding that support low economic students to ensure a college or career vision. City and County should clean up Durham and enforce an environmentally clean and safe image in schools and within the community.",2
"Clean schools several times/days to beat back COVID and use the Federal money to install new, more effective air filtration systems. We GOTTA get kids SAFELY back in the classrooms!",2
Clean up the parks.,2
Community involvement.,2
"Community schools with wrap around services, get cops out of schools, a real investment in public health services, arts, dance, music opportunities.",2
"Competent teachers, mental health assessment, equity in education to all.",2
Computers and internet need to be available to all.,2
"Connection between govt, schools, and church.",2
Consistently promoting programs to magnify/ bring out their potentials. Resources broad?casted more.,2
Continue advocating the importance of no child left behind.,2
Continue improving coordination of services and education/skill development to support kids and give them positive learning and living environments.,2
Continue to improve the schools.,2
"Continue to invest in: Education, Social services (ONLY for families who truly need it, and it should be temporary NOT years and years) and Churches.",2
"Continue to provide a quality, and equal education with qualified schoolteachers, and eliminating troublemakers in the classrooms so all children can achieve, without the threat of violence, and bullying from other children. all ages.",2
Continue to provide well rounded meals in the schools for all children. Ensure dental and health care  availability  for  all  students.  Provide  mentors  in  the  schools.  Encourage  industry  to  have summer employment availability. Programs to assist parents in improving parenting skills.,2
Continue to teach them that Durham can be a beacon of a place that Terry Sanford & John Hope Franklin called home (I knew both later in life). The city that was the childhood of Pauli Murray.,2
Create more  opportunities without stimulations  teach our children as if  they have  to become adults show them support understanding self?programs provide transportation.,2
Create safer places to play. Clean up the Tobacco Trail at Fayetteville Road. Clean up the garbage. Create more artwork directed at children.,2
Dangerous to walk to school.,2
Do better.,2
Do everything possible to ensure they don’t get lost in the system.  Address their unique needs in a timely fashion. Utilize best practices like those used at Student U and East Durham Children’s Initiative.,2
Durham needs to use more of its resources to deal with gun violence.,3
"Durham should offer more free programs for teens. Could offer training on things that would impact day to day living such as automotive, shopping for groceries, housekeeping and childcare.",3
We must make sure that the parents get their education and knowledge and the jobs to support their families. The children want to be proud of their community and help build it stronger.,3
"Each  home  is  different  and  has  different  needs,  but  I  think  offering  free/low?cost  classes, programs to kids that includes transportation, and a snack would bring kids off the streets and into a staff environment where they can learn trades, sports, art, dance, exercise.",3
"Earlier intervention with services for children and families living in poverty, with emphasis on the social determinants of health and well?being and the ACE (Adverse Childhood Experience) scores for elementary school age children.",3
Early intervention to deter youth violence.,3
Education.,3
Education and protection.,3
Education and safety. Activities to keep children busy in safe environment.,3
"Education, food access for economically challenged. work study/mentorship for teenagers.",3
"Education, less government assistance. Advocate fathers in the home. Penalize those who don’t pay child support and encourage young men to treat women with honor and dignity. Do not feed child fear or law enforcement but to respect others.",3
Elevate the curriculum to bring overall score 3 to a 4 in Durham. Why does Target not have a teacher discount? Make it nice for teachers and they will want to come to our schools to teach.,3
Empower educators to work collaboratively to tailor programs that fit the educational needs of the children in their schools and allow for those children who require additional one on one help to achieve their best potential.,3
"Encourage all, don't teach CRT, don't lower the standards.  Re?enforce that each one is worthy and valuable.",3
Encourage two parents in household,3
Enforce existing codes and regulations!!,3
Enforce high standards for schoolteachers; keep school facilities maintained; support parks and recreation activities; get the criminals off the street and keep them off the street (address root causes of gang appeal for Durham youth).,3
"Enforce  laws  for  their  lawbreaking  parents,  and  for  the  youth  when  they  follow  in  their lawbreaking parents' footsteps.",3
Enhance scholarship opportunities for gifted children and extra help for those with special needs.,3
Enhance  social  services  (free  lunch  for  all)  and  issue  uniforms  in  public  schools  to  decrease unneeded stress on parents and shame for disadvantaged children.,3
"ensure access to education early with Pre?K. By 3rd grade all young people should be on a grade level, if not exceeding it.   All youth graduate HS and if not going to college, have the option for trade school/vocational programs.",3
Ensure adequate and appropriate schooling and education opportunities.,3
"Ensure  school  systems  are  high  quality.  Start  after  school  programs,  make  tutoring  programs available.",3
Ensure teenage stay in school un,3
"Equality, diversity, non?business across the board is the only way. I envision this happening.",4
"Established workshops, social events, planned teen clubs, etc.",4
Every  child  should  get  a  good  start  in  life  with  access  to  high  quality  health  care  and  early childhood education.,4
Excellent teachers and programs.,4
Expand access & support for school counselors/college & post?secondary planning.,4
Facilitate  axes  to  and  use  of  educational  cultural  and  social  opportunities  to  all  segments  of population.,4
"Family should have the opportunity to send their children to schools that provide a rigorous and positive  learning  environment.  Practically,  this  means  providing  charters,  magnet  schools, academic pathway opportunities, and private school scholarships and vouchers. The data bears this out, in that the highest performing middle and high schools in Durham are those where some manner of choice is involved, be it lottery, applications, or private school.",4
"Federal, state, and local budgets must consider education ? not only academic but arts, vocational, environmental opportunities ? a primary focus. Our recreational centers are a big help, but schools and proper school nutrition programs and extra interest programs are vital. Every child counts.",4
Find innovative ways to link to the local universities and large employers to support schools.,4
Fix the schools.,4
Focus  on  learning  and  not  just  test  scores.   End  EOG  testing  and  focus  on  actually  learning materials that will help later in life.,4
Focus on recruiting and maintaining high?quality teachers and other education professionals.,4
Food  security.  Access  to  public  school  resources ? important  to  keep  schools  open  during  the pandemic so that students can access these resources.,4
"For minors, provide mentoring and educational tutoring support or partner with organizations that provide such services such as the Emily K Center. However, ALSO recognize that the city and county abs cannot not do the parents' job. Parents need to step up and do THEIR job as parents. Maybe some parents need training or mentoring on how to do that effectively...so maybe the city/county could offer that if it's not already available. But I, for one, am extremely tired of public funds  be  thrown  repeatedly  into  areas  that  are  properly  the  domain  of  parents,  not  the city/county, and more importantly, these measures never address the root causes of why some kids are falling behind, such as children having children and a total absence of any father figure in the child's life.",4
"For youth who get in trouble with the law, restorative justice programs are worthwhile.",4
Foster a no fail requirement for teachers and parents.,4
Free after school care. Free or low?cost school lunches.,4
"Free childcare, free pre?k for all.",4
Free or heavily subsidized preschool for all! Safe and inexpensive childcare and good wages for those in early childhood care.,4
"From  kindergarten  to  high  school  our  kids  need  excellent,  well?paid  teachers  and  safe  school interiors and playgrounds. They should receive free healthy lunches.",4
Fully fund public schools. Pay teachers significantly more. Fully fund healthy food options. Fully fund club and after school sports activities. Fully fund transportation both for the schools and the public so that no student has to be at school before 8:30 am.   Fully fund restorative practices and mental health professionals in the schools. Fully fund deferred maintenance. Tear Githens down and start over.  ,4
Fully  fund  universal  post?partum  nurse  home  visits  like  those  provided  by  Family  Connects Durham.,5
"Fun pre k education, free after school programs.",5
Fund all public schools equally.,5
Fund or contribute more investment in public schools and related programs.,5
"Fund public health, abolish police, read the Youth Voices report published by the youth office and do  those  things.  Involve  youth  from  the  start.  Consider  a  youth  bill  of  rights,  created,  and maintained by the youth of Durham.",5
Fund public schools and subsidize childcare.,5
Fund schools more.,5
Fund the schools.,5
"Funding  for  schools  should  be  standardized  and  all  kids  should  receive  the  same  tools  and resources, regardless of which school they go to.",5
"Get crime under control, especially shootings.",5
Get everyone into housing. Think out of the box. Make sure they get enough food. Make sure they are able to get to school.  Make buses free.,5
Get panhandlers off of hwy 70 and Miami and Sherron rd.!!!!!!,5
"Get rid of some of the layers of admin in the public school system, hire better teachers & allow taxpayers to have a direct voice in how our hard?earned tax dollars are spent on a school system that seems so far behind our neighbor counties.",5
Get rid of the gangs.,5
Give every school the finances and materials (tools) equally. Keep neighborhood schools.,5
"Give everyone the same opportunity & treat all children the same, not catering to one race or another! all, the same.",5
Give more incentives.,5
Give teachers and assistant teachers a raise.,5
"Go after gang activity to keep kids away from them! If kids have no responsible adult in their lives, have a mentor. More affordable and safe day/after care for children of working parents. More support for teachers!",5
Go back to teaching the basics of life values.,5
"Good public schools, tutoring, mentorship, family support, community activities.",5
"good  schools,  fair  housing,  affordable  housing.  good  police  services  sensitive  to  poor people/minorities.",5
"Greater  access  to  public  parks,  stronger  schools,  mentorship  programs  with  local  universities, access to affordable child?care & housing. Decrease gun violence.",5
GUN CONTROL so they may live beyond 16 ?18 years old!!! Gang dissolution!,5
"Have (encourage) parental interest and involvement in their children, most important!",5
Have a curfew.,5
"Have different educational programs, a safe haven for the youth implements programs to help the youth thrive for excellence.",5
"Have more activities for school age kids and places for school age kids only just for teens, no outside r that what cause trouble.",5
Have more community?based programs for school aged children that are supervised and safe.,6
"have more free programs for all kids, different workshops for different interests.",6
Have more mentor programs for the youth. Between the ages of 10?18.,6
"Have  more  opportunities  for  them.  Youth  games  free,  training  for  sports  free.  Talent  shows. Different opinion to enjoy life.",6
"Have more ROTC programs in our schools? Also more LEO friendly programs like P? ce week, Fire safety week.",6
Have more supervised after school programs.,6
Have more youth related programs.,6
Have parents get more involved with child instead of relying on the system so much.,6
Have place to enrich their potential tutoring programs for troubled youths that need an extra push.,6
Have recreational facilities with programs and transportation for the youth.,6
"Help  eradicate  poverty,  higher  and  retain  better  teachers,  train  teachers,  treat  teachers  with greater respect and increase teacher salaries.",6
Higher paid educators with better benefits and resources for public schools/teachers.,6
Higher salary for teachers and better quality of schools.,6
HIRE QUALITY TEACHERS AND ALLOW THEM TO INFLUENCE POLICY. SUPPORT TEACHERS NEEDS,6
Hire quality teachers and staffing in our public/charter schools. offer great recreational facilities and activities. Provide public/private partnerships/internships to promote good work habits.,6
Homework help for all. Start time too early.,6
"I  strongly  feel  all  children  should  be  afforded  the  same  opportunity,  to  be  exposed  to  early childhood  development  as  early  as  3  years  old.  Also  understand  that  everyone  is  not  college material  but  is  capable  of  learning  a  trade  through  proper  training  from  a  professional.  That training and certification could afford them the opportunity to be homeowners, earn a decent salary, become a businessperson, and become a productive citizen instead of a gang banger. I believe kids need nurturing. We got money for everything else. We need a Job Corps Center in Durham at the Holton Center on Driver St.",6
"I think by building a few places for recreational interaction such as, skating, after school activities, bowling, help with homework, a safe place to thrive without fear of guns and violence, they need something to do to release their energy freely.",6
I worry about the lack of drive?in teenagers.,6
"Improve crime rate, more control of gangs.",6
Improve education/resources.,6
Improve our public schools.,6
"Improve our school system!!!!  We need smaller class sizes, more teachers, higher teacher pay, more support services to help students.",6
Improve  our  schools.  Invest  in  education.  Schools  have  been  struggling  since  the  city/county merged.,6
Improve public education facilities and teacher pay to attract top students.,6
Improve  public  school  education  in  the  city/county.  Improve  schools  and  teachers'  salaries  to attract and retain high quality teachers.,6
"Improve public school infrastructure to make schools a desirable place to learn and teach, support teachers, more affordable, quality childcare.",6
"Improve public schools (including better teacher pay to attract and retain good teachers, and seek out visionary, committed leaders in admin rather than the current revolving?door admin approach DPS seems to have); build more parks and green space in areas where they’re lacking (north gate mall  could  have  been  an  amazing  park!);  improve  recreational  opportunities  for  kids  all  over Durham; build and staff more public swimming pools and start affordable swimming programs for kids  (I  was  shocked  at  how  few  pools  there  were  when  I  moved  here);  start apprenticeship/mentor programs for high school kids.",7
Improve public schools!,7
"Improve public schools, fee Pre?K.",7
"Improve public schools, increase number of charter schools, eliminate CRT from schools, provide for job training.",7
"Improve public schools, job opportunities, and recreation opportunities.",7
"Improve quality of schools and after school/summer camps and programs (this includes increasing teacher  pay  to  attract  quality  instructors!!).  MORE  YEAR?ROUND  SCHOOLS  for  K?8  so  children have less learning loss and parents can budget for childcare during breaks that are spread out vs. all at one time (e.g., a traditional calendar summer). Educating our youth well and preparing them for  the  future  with  better  learning  opportunities  will  help  children  of  Durham  reach  their  full potential.",7
Improve schools.,7
"Improve schools, stop gangs.",7
"Improve  teacher  training,  administrative  training.  Improve  teacher  retention.  Provide  highly trained teachers. Improve teacher salaries. Make sure children have access to technology.",7
Improve the facilities in all the neighborhoods not just the wealthy neighborhoods.,7
Improve the public school system.,7
Improve the quality of the public?school education opportunities.,7
Improve the schools and the after?school care.,7
Improve underserved schools. Improve services for 'at risk' youth. Improve job opportunities for parents and teenagers. Lower cost of quality childcare.,7
Improved access to childcare.,7
"In  my  mind,  it’s  more  what  the  STATE  can  do?expand  Medicaid.  Also,  work  on  those  school buildings.",7
"In the public schools located in lower income areas, allow more money to go to these schools to make smaller class sizes, more opportunities for students, pay teachers more.",7
Increase access to mentoring.,7
Increase parental involvement.,7
Increase resources and pay for teachers.,7
Increase school funding.,7
"Increase teacher pay, broaden the curriculum, stop giving charter schools money meant to fund public schools.",7
Increase teacher salaries and support them in their efforts to help students thrive.,7
Increase teacher’s salary.,7
"Increase teen services and jobs. Mental health support, more pre k.",7
Increased availability/access to free/low cost before/after school resources; free school breakfast and lunch; universal free pre?k.,7
"Invest  in  DPS?  more/better  schools,  less  charters,  better  districting  for  more  equitable  school communities, pay teachers/staff enough to live in Durham.",8
Invest in every area of life for all age groups being guided by statistics of age of residence.,8
"Invest in more opportunities for the youth (13?18) to have more fun after school programs that are free or low cost. Invest in art, dance, and music programs for kids.",8
Invest in public education.,8
"Invest in public schools and early childhood education programs, increase public safety.",8
Invest in quality of public schools and transportation to and from those schools.,8
Invest in resources for equitable education.,8
Invest in schools. Defund police.,8
Invest in teacher salary and development.,8
Invest in the public school system to dismantle segregated learning communities. This impacts the quality of educators who decide to work on these spaces. And all children deserve high quality professionals.,8
Invest in the school system and in recruiting highly qualified teachers and retain them through initiatives and fair and competitive pay.,8
"Invest  in  your  schools.  Decrease  taxes  to  incentivize  businesses  to  keep  moving  into  Durham. More jobs, good education, less taxes=less at?risk youth looking to make ends meet by dropping out to work or join gangs.",8
"Invest in youth activities and after school care with sports so they can learn to work together as teams and have good role models to help them grow. Fix the public schools so we don't have to pay $20,000 every year in private school tuition anymore. You are losing the parents who could make your schools great by not providing enough structure and safety in the DPS schools. We have all had to flee to private schools.",8
Invest more in early education??supporting subsidy slots for ALL 3? and 4?year old's and improving the early childhood education workforce.,8
Invest more in public schools and reward quality educators. Cease financial support of so?called charter schools and return those funds to public schools where they belong!,8
Invest more in public schools. We should be the most attractive school district in the nation for teachers and ALL students. Offering both academic and vocational high?quality opportunities.,8
Invest more money into the police school system and private / charter school funding.,8
invest seriously and significantly in parks and programming. increase funding for public schools. aggressively re?district to create more solid economic diversity in Durham Public Schools.,8
"It  starts  with  education  and  outreach  programs,  community  involvement,  and  I  willingness  to provide volunteer opportunities for adolescent youth as a part of survey price and community involvement. Allowing young people to experience in many aspects of their arm county and city government and all it provides fosters and creates the ability to retain the N key vocal talent, and creates a better understanding of the need’s germs use particularly between the middle school and high school years were most kids find themselves most of suspectable to climbs drugs etc.",8
Keep improving the quality of schools in all neighborhoods.,8
Keep our children safe.,8
"Keep schools safe. Good teachers. Adequate discipline Parent involvement, more charter school options.",8
Keep the public parks and recreational facilities safe. Improve the quality of public schools.,8
Keep them alive by stopping all these flagrant red?light runners. These northern folks need to leave their impatient driving habits behind when they move south. Less financial support from the govt? they become so dependent and lazy. They need to learn the ropes of life.,9
