response,page
Let's try to do a little bit more education and making the schools fun to come to and give them a more activities in school with athletics things happening on campus led the recreation department come  together  with  the  schools  and  the  police  department  and  the  fire  department  let's  get everybody involved and let's try to attend at least two schools a month until we accomplish all of our schools have something on those campuses while they're going to school and let them know it's all about education.,9
"Maintain our parks and schools. We seem to have millions to build new, but we let things fall into disrepair all too quickly.",9
Make all equal. More after school programs.,9
"Make Durham public school the best schools in the state. Have free childcare options, pre?K, and social programs for all ages. Durham should be the benchmark for education and social services in NC.",9
Make neighborhoods safe.,9
Make neighborhoods safe for kids to be outside (speed bumps).,9
Make parents accountable for standing at the bus stop with their children under the age of 12. Go to the schools and the children and the youth what can be done to help them reach their full potential and thrive.,9
Make public school budgets a top priority.,9
Make  sure  access  to  schools  is  open  to  everyone.  Erase  procedure  that  favors  more  affluent families when it comes to school selection.,9
Make sure materials and staff are plentiful in schools.,9
Make sure parents have opportunities.,9
"Make sure parents understand a lot of their children thrive & potential start with them supporting and helping them develop their dreams & desires. Help parents understand that DPR is a great starting place to introduce their children to arts, sports, writing, etc. before enrolling them in private class.",9
Make sure public schools in lower income areas are given the same opportunities as those in higher income.,9
Make sure they have a safe place to live and can get help when they call 911.,9
"Make the neighborhoods safer for kids to openly play outside. There are a lot of homeless, drugs and gunfire around our neighborhood that prevent me from letting my child outside alone.",9
Make the Southpoint mall a safe place to go.,9
Maybe some type of family therapy services?,9
Meet student’s needs.,9
Mentorship programs.,9
"Middle & high school, provide more after school programs.",9
Monitor educational progress in schools.,9
More activities and sports throughout the city.,9
More activities for children.,9
More activities for youth.,9
"More activities that encourage different race, ethnicity, and nationality to coexist and learn from one another.",10
More affordable housing mixed with new development.,10
"More  after  school  and  summer  programs  for  all  ages.  Include  reading,  math,  and  language enhancement. Arts, dance, band and singing opportunities. Plenty of games both physical and mental.",10
More after school educational programs.,10
More after school programs to give All children the opportunity to thrive in a healthy lawful way.,10
more communication with new parents in area.,10
More community?based activities and free transportation to get them there.,10
More community recreation activities.,10
More discipline. Less wokeness. No CRT.,10
"More  drug  enforcement  in  schools,  drug  sniffing  dogs,  drug  testing  for  athletes  and  more enforcement  in  locker  rooms  and  bathrooms  and  mental  health  supports  for  students  and teachers/staff, more police officers. The ones we have are fantastic, but we need more. Teachers need less pressure, more support, money for supplies and adequate pay. The magistrates are confused, and you never know what to expect, I have had to file a number of IVCs because of my job and the process can be quite frustrating because of inconsistencies and even misinformed magistrates. Also, sometimes they are rude, and the office is not staffed. One time I wakes into the jail entryway, and no one was there for 90 minutes, no security, no magistrate, no one and then the magistrate was extremely rude and belittling.",10
More free community centers. More free sports activities.,10
More funding for schools.,10
"More funding into youth outreach, juvenile support.",10
More funding to renovate schools. invest more /get involved.,10
more interaction with police so they recognize police as friends and trusted advisers. Make sure class sizes do not exceed 25 students with a goal of 20 max. Dismiss non?performing educators.,10
More involvement and community engagement.,10
More mentoring.,10
More  mentors  and  programs  that  provide  transportation  for  those  who  don’t  have  it  for  the children and teens.,10
More money for education for the young. Ok to raise taxes for our youth.,10
"More money for student and schools, teacher salaries.",10
"More money to school. More services to those that fall outside the typical range (so both gifted and special needs). Opportunities for low?income kids to participate in music, arts, sports, stem etc.",10
"More Montessori magnets, more school of the arts magnets.",10
More pre k opportunities.,10
More programs to help after school not involve in gangs and crimes for underprivileged.,10
More programs to keep the children/teens off the street.,10
More public volunteer services/projects available thru schools for outreach in the community.,10
More recreational activities.,10
More recreational centers and planned activities for teenagers.,10
More recreational facilities and be more involved in community support.,10
More resources for schools.,11
"More subsidized youth athletic programming. Sidewalks and protected spaces for kids to move and  play.  Equitable  distribution  of  public?school  funding,  divorced  from  zip  code  and neighborhood property values. Greater vaccine distribution availability and rapid testing sites. Keeping  police  out  of  classrooms.  Not  putting  in  the  juvenile  detention  facility  in  downtown Durham and maintaining the classroom to jail pipeline for our Black and Hispanic community.",11
"More youth programs, ways for them to get involved.",11
"My child starts pre?k next yr., thankful for the opportunity.",11
"My children are all adults and grew up elsewhere, so I am not qualified to answer.",11
"Need a rec center, swimming pool.",11
Need more apprentice programs. Some kids don’t need to finish high school they can get a GED and go to trade school. Need to offer part time jobs starting in middle school.,11
Neighborhood school funding. Less money spent on magnet.,11
"Not sure however, provide assistance to parents in providing guidance to their children and other youths.",11
"Offer equally educational opportunities; teachers, supplies, computers/laptops, uniforms, sport equipment, etc. Up?to?date equipment and facilities. Free 2?year community college.",11
"Offer more outside spaces for families. Outdoors track facilities, entertainment capacity. Recruit better teachers and police officers.",11
Offer more recreational opportunities such as outdoor basketball courts and tennis courts and baseball fields and indoor courts as well.,11
Offer more/some job to teens it will help keep them out of gang and off the street.,11
"Offer  programs  that  teach  civics,  and  leadership.  Internships  with  companies  and  small businesses. Ways to become entrepreneurs.",11
"Offer training for youths, more recreational activities.",11
"Offering a wide range of activities for pre?teens to encourage exercise, arts, and learning.",11
One big problem is gang control. I have been robbed at gun point by very young kids.  I say ages 15 to 18. Kids need to stay in school and have a plan in place for their future.,11
"Organize athletic programs, tutoring, mentorship programs for all youth. This is an opportunity to create jobs.",11
Our teachers need to be fairly compensated. affordable day care. Schools need to teach children to swim.,11
Parenting interventions and involvement. To many kids have no parent involved and schools have no resources to help. Education starts in a home of people who believe in assisting their children in receiving and accepting it. You can help but no change the view of the parents.,11
Pay teachers and provide resources for better retention.,11
Pay teachers better. Build and repair parks. Increase computer access for all kids.,11
Pay teachers more.,11
"Pay  teachers  more,  give  schools  more  funding,  stop  catering  to  the  loud  minority  and  make decisions that's right for the city based on the information available and stick to it.",11
"Pay teachers more, provide more support for families with children.",11
"Pay teachers more, require higher standards for teachers.",11
"Pay teachers more. invest in schools, get rid of bloated administration.",11
Poverty prevention? programs and access to good school system.,11
Preschool  for  all  children.  After  school  programs.  Creative  ways  to  teach  those  who  learn differently.,12
Prioritize  quality  teaching.  leadership  &  retention  of  talent  in  public  schools.  Stop  allowing charters to siphon off public funds.,12
Promote family units with a mother and father.,12
Proper after school and summer enrichment opportunities at low/no cost to working families.,12
Protective services for families. Need more social workers.,12
Provide a better education. Keep the streets safe.,12
"Provide a range of paid employment, volunteer opportunities, and after school activities in at risk neighborhoods for all age groups.",12
"Provide a safe and healthy environment to allow all children to feel wanted, needed, and belong.",12
Provide a safe and secure environment for them to thrive. Improve public school systems. Provide cost effective recreational and athletic opportunities to promote a positive environment and keep them out of trouble.,12
Provide affordable housing and extracurricular activities.,12
Provide  afterschool  enrichment  and  athletic  programs.  Provide  apprentice  and  internship opportunities for high school students.,12
Provide better schools.,12
Provide citywide intramural basketball. Talent shows. Art exhibits etc. For teens (12?18) in order for them to compete and be seen in a positive genre. These activities out of reach for some teens at school due to negative behavior.,12
"Provide enough, safe, park space and facilities.",12
"Provide equitable social support, economic, & educational resources across all neighborhoods and communities and schools in Durham city and county. Where neighborhoods and communities have low resources and clear disadvantage, the city and county need to increase the provision of those resources, services, &! Opportunities to alleviate adverse conditions.",12
Provide food and education.,12
"Provide FREE activities. Tutoring, financial literacy classes.",12
Provide free early learning and childcare options.,12
Provide  good  school  programs  &  activities.  Limit  who  is  allowed  to  have  children  to  what city/county can achieve to substitute for family care.,12
"Provide more support to public schools to include reduced class sizes, more academic and non?academic programs, and access to school activities.",12
Provide one on one help for students needing it.,12
Provide safe places for children to be after school.,12
Provide transportation to them to participate when parents must work.,12
"Provide well kept, safe areas for Play and recreation.",12
Public Pre?school/daycare.,12
Put God back in the school system. Teach them about morality and hire God?fearing teachers.,12
"Put  maximum  funding  into  public  schools.  Provide  adequate  support  staff  at  schools  for counseling, administration, etc., to free teachers to teach. Provide job training opportunities for those students who will not attend college. And provide free after school programs that engage teens in positive activities.",12
Put more emphasis on education.,12
Put  more  money  into  public  education  and  social  services  to  support  poor  and  single  parent families. After school programs and food programs are also important.,13
Put  vocational  education  classes  back  in  the  schools!  Every  kid  is  NOT  going  to  college!Neighboring counties like Orange County still have those classes!!!!!,13
"Quality public education (not charter schools, not private schools) that is inclusive of everyone. Programs that are driven for different learning types and capabilities.",13
Quality teachers in all schools. Have children who don’t want to learn go to alternative schools so the children who want to learn will have that opportunity.,13
"Reach out to children and teens in subsidized housing to get them involved with educational, artistic, and athletic programs that will give them something to do other than get into trouble. There's a teen center in Lyon Park and I've never seen anyone at it. Seems very underutilized as is the baseball field beside it.",13
"Conduct support groups for ages 10 to 15 years old and find out their concerns, what they think, what they feel for them and for themselves in order to help them be more focused on their decisions and not make mistakes at an early age so that learn to take care of themselves and their community and respect the people around them who are cautious...in reality, youth need a lot of help for a better tomorrow...helping youth is the best thing that can be done do for a better life in the future... to care for and grow what is already there in the present....thank you...",13
Recreation centers that offer experiences for children ages 8?18 are important in helping children rea h their full potential.,13
Recreational resources for youths.,13
Reduce class size.,13
"Reduce poverty, increase job opportunities/training for under?resourced communities so parents have jobs, increase # of counselors/social workers in public schools, so teachers have less burden trying to address students' needs beyond school.",13
Reform  zoning  to  make  new/existing  developments  in  Durham  mixed  income  and  increase development  in  East  Durham ?>  thereby  reduce  concentrated  poverty  and  de?facto  state  of racial/economic segregation.,13
"Regular communication with public school employees at all levels. Any employee no matter what job or title should be encouraged to actively reach out to county officials and share thoughts, ideas, or concerns. Parents of all children should also be encouraged to do the same. I hope the county puts a major focus on providing resources for all students in the public schools and put emphasis on making schools feel safe.",13
Reliable transportation.,13
Remove all vaccine and mask mandates. Parents should decide where children go to school so offer competitive school choices to parents.,13
Safe activities.,13
"Safe after school programs, more visible opportunities for people to volunteer to help post COVID",14
"safe  neighborhoods,  nutrition,  access  to  play/parks  spaces,  pre?K  programs,  adequate medical/dental care, and support for learning disabilities.",14
"Safe,  comprehensive,  accessible,  well?promoted  programs  and  facilities  to  ALL  youth;  upper?middle?lower class of all races.",14
School and job training.,14
School vouchers.,14
Schools need to be safer and teacher salaries need to be increased to attract and retain quality professionals.,14
Schools should be equal all across the board with resources and teachers.,14
"Schools, churches, government, and families work together.",14
"Smaller class size, more after school free spaces. Invest in school facilities.",14
Smaller  class  sizes  so  kids  with  ADHD  or  behavior  challenges  aren't  constantly  removed  from classrooms.  They need more support and different solutions.,14
"Smaller  classrooms.  More  pay  for  teachers  (you  get  what  you  pay  for).  Education  should  be number one concern not athletics. Sports are ok but must maintain GPA to play. Need every day gym classes. Life skills classes on marriage, budget. And applying for jobs. Trade schools. Parenting classes. Paying taxes.",14
Some schools are underfunded and poorly run with racial problems. My family had to move to a neighborhood with a better school though they hated to move.,14
Spend money in schools and actually commit to it.,14
"Spend more money on public education, teachers, keeping kids in school.",14
Stop calling Durham city police unless they don't carry guns.,14
Stop enforcing laws that prohibit marijuana use.,14
Stop pushing race as the primary factor that children cannot succeed. Focus on providing quality education on the core competencies. Provide more law enforcement in high crime /gang areas so that children don’t live in fear.,14
Strong public schools regardless of neighborhood.,14
Substantial improvement of quality of academic rather than teacher union directed instruction and curriculum at all public schools.,14
Support and encourage better and more involved parenting.,14
Support charter schools.,14
Support programs like Kidznotes.,14
"Support public schools: quality, variety of instruction, teacher pay to attract good teachers, etc.",14
"Support the educators, good salary, money to buy needed supplies for all.",14
Support  the  neighborhood  groups  that  are  working  on  these  goals  and  follow  their  lead  and wisdom.,14
Take care of the teachers.,14
Teach them Dave Ramsey financial literacy.,14
Teachers need to get paid more.,14
Teenager having a place to go to get help with school and finding meaningful work that could take them into adulthood.,14
Teenagers starting at 11 need programs and community?based spaces to help them learn.,14
"Teens: High school age, there should be more teen related facilities for gathering and mingling with friend. The Streets at South Point used to allow for this until the Northgate mall closed",15
"The efforts of the P&R, library and social services are good. I like that the police & fire dept do annual community events. Please refurbish and maintain low?income housing. I would like to see more housing neighborhoods & quality construction in the 100K price range. Durham has a lot of high end and low end and not much in the middle.",15
"The magnet school system is a great start. Decent housing for all kids is so important??functional housing away from crime areas and safe transit to schools. After?school programs for kids whose parents must work. Safe places for kids to be when their guardians aren't around.  Alternative outlets for youth angst and energy (alternative to gangs.)  Not de?fund the police but add a ""social worker"" component.",15
"There  are  huge  socio?economic  disparities  existing  in  Durham  right  now,  and  gentrification  is pushing marginalized people out. We need to start with affordable housing that is pleasant. Then fix  school  facilities  and  ensure  enough  bus  drivers,  teachers,  cafeteria  workers.  Then  provide programming to teach skills and pull people out of poverty.",15
"To be safe, listen to the world and do the best they can and do your best.",15
Treat all the same.,15
"Try improving the quality of management in schools. Even if individual teachers are very good, continuity and consistency are lacking.  I believe I've read that DPS receives the second?highest level of funding per student in the state.  The outcomes don't reflect that. Stop the misguided downtown development. I don't need a Google office there.  Put it in the park. Durham's policy has exacerbated a housing crunch that may have been there anyway while losing out on economic development. You can call yourselves """"progressive"""" but having kids shot near my house, failing schools, and a lack of affordable housing isn't the kind of progress I want.",15
"Turning schools into community centers and safe spaces with social services resources, recreation for families and tutoring options & family education.",15
"Tutors, translators for the Spanish.",15
Universal pre k for all children.,15
Universal pre?k.,15
"Universal pre?k, skate parks.",15
Universal pre?k. Safe places to play in every neighborhood. More kids living in a supportive home environment.,15
Update all schools to be more compatible with society today.,15
"Use  funds  to  give  youth  resources:  better  access  to  mental  health  services,  opportunities/internships, education—rather than for new youth detention center.",15
Utilize retired and elderly for educational and skills training. It's a win/win situation.,15
Very important to improve this plan.,15
We need to improve the quality of teachers and seriously improve teachers’ salaries to recruit excellent teachers in public schools. I am a teacher in middle school.,15
Work on the quality of the public school system.,15
Work on the schools and crime.,15
Work to improve the quality of public schools. Add and improve sidewalks surrounding public schools so children can safely walk to school.,15
Work to stop the influence of gangs. Need more mentors and facilities to keep kids out of trouble and focusing on life?long skills.,16
"You can’t just have a few stand out teachers or schools and clap for yourself.  You have to have a good school system. The grades speak for themselves. These kids are undereducated in every category. I would move to a shack in Chapel Hill before I would live in a mansion in Durham and send  my  kid  to  public  school  in  Durham.  I  tried  Ignite!  This  year.  Better—but  really,  it’s  just OnDemand home schooling.",16
"Young children need a strong male & female model of good character as they grow & mature. Children might meet their potential if the city & county encouraged “family” events, supported Big Brother type of organizations, & supported unwed mothers not only with money but teaching them skills. Much research suggests that even 1 good person who models good behaviors can make a difference in a child’s life & help break the bad cycle from which the child comes. I know this research to be true from witnessing lives of people I know. They are people who broke out of the bad cycle & are now contributing members of society.",16
Youth centers.,16
Youth need a center for activities.,16
